Тип агента;Наименование агента;Электронная почта агента;Телефон агента;Логотип агента;Юридический адрес;Приоритет;Директор;ИНН;КПП
МКК;МонтажОрионУрал;email: pzaitev@blokin.org;(35222) 67-39-26;\agents\agent_96.png;027573, Тамбовская область, город Коломна, ул. Ленина, 20;50;Давыдоваа Нина Евгеньевна;1692286718;181380912
МКК;МетизСтрой;kristina.pakomov@burova.ru;phone: 8-800-172-62-56;\agents\agent_94.png;254238, Нижегородская область, город Павловский Посад, проезд Балканская, 23;Приоритет = 374;Ева Борисовна Беспалова;4024742936;295608432
ОАО;РадиоСевер;maiy.belov@rogov.ru;(495) 368-86-51;\agents\agent_123.png;491360, Московская область, город Одинцово, въезд Ленина, 19;431;Карпов Иосиф Максимович;5889206249;372789083
ООО;Компания КазАлмаз;irina.gusina@vlasova.ru;8-800-533-24-75;\agents\agent_80.png;848810, Кемеровская область, город Лотошино, пер. Ломоносова, 90;396 в приоритете на поставку;Марк Фёдорович Муравьёва;3084797352;123190924
ООО;Компания СервисРадиоГор;nika.nekrasova@kovalev.ru;phone: 8-800-676-32-86;\agents\agent_40.png;547196, Ульяновская область, город Серебряные Пруды, въезд Балканская, 81;169;Попов Вадим Александрович;8880473721;729975116
ЗАО;ВодТверьХозМашина;tkrylov@baranova.net;phone: +7 (922) 849-91-96;\agents\agent_56.png;145030, Сахалинская область, город Шатура, въезд Гоголя, 79;Приоритет = 8;Александра Дмитриевна Ждановаа;4174253174;522227145
ОАО;Тех;vasilisa99@belyev.ru;+7 (922) 427-13-31;\agents\agent_61.png;731935, Калининградская область, город Павловский Посад, наб. Гагарина, 59;278;Аким Романович Логинова;9282924869;587356429
ООО;ТверьМетизУралСнос;email: rlazareva@novikov.ru;(35222) 57-92-75;\agents\agent_109.png;880551, Ленинградская область, город Красногорск, ул. Гоголя, 61;165;Зоя Андреевна Соболева;1076095397;947828491
ЗАО;МясРеч;bkozlov@volkov.ru;8-800-453-63-45;\agents\agent_58.png;903648, Калужская область, город Воскресенск, пр. Будапештсткая, 91;355;Белоусоваа Ирина Максимовна;9254261217;656363498
ЗАО;Флот;gerasim.makarov@kornilov.ru;8-800-144-25-38;\agents\agent_87.png;505562, Тюменская область, город Наро-Фоминск, пр. Косиора, 11;Приоритет = 473;Василий Андреевич Ковалёв;1112170258;382584255
ЗАО;CибПивОмскСнаб;evorontova@potapova.ru;+7 (922) 153-95-22;\agents\agent_46.png;816260, Ивановская область, город Москва, ул. Гагарина, 31;477 в приоритете на поставку;Людмила Александровна Сафонова;5676173945;256512286
ЗАО;ЦементАсбоцемент;email: polykov.veronika@artemeva.ru;phone: (495) 184-87-92;отсутствует;619540, Курская область, город Раменское, пл. Балканская, 12;426;Воронова Мария Александровна;4345774724;352469905
ЗАО;ТелеГлавВекторСбыт;nsitnikov@kovaleva.ru;(35222) 56-15-37;\agents\agent_31.png;062489, Челябинская область, город Пушкино, въезд Бухарестская, 07;185;Екатерина Фёдоровна Ковалёва;9504787157;419758597
ОАО;Инфо;arsenii.mikailova@prokorov.com;8-800-793-59-97;\agents\agent_89.png;100469, Рязанская область, город Ногинск, шоссе Гагарина, 57;Приоритет = 304;Баранова Виктор Романович;6549468639;718386757
ЗАО;ЭлектроРемОрионЛизинг;anfisa.fedotova@tvetkov.ru;(495) 519-97-41;\agents\agent_68.png;594365, Ярославская область, город Павловский Посад, бульвар Космонавтов, 64;198;Тарасова Дан Львович;1340072597;500478249
ООО;Компания ТелекомХмельГаражПром;email: qkolesnikova@kalinina.ru;(812) 983-91-73;\agents\agent_71.png;126668, Ростовская область, город Зарайск, наб. Гагарина, 69;Приоритет = 457;Костина Татьяна Борисовна;1614623826;824882264
ООО;Компания Алмаз;akalinina@zaitev.ru;+7 (922) 688-74-22;\agents\agent_121.png;016215, Воронежская область, город Зарайск, ул. Косиора, 48;Приоритет = 259;Фоминаа Лариса Романовна;6698862694;662876919
ОАО;МясТрансМоторЛизинг;email: vlad.sokolov@andreev.org;phone: +7 (922) 676-34-94;\agents\agent_62.png;765320, Ивановская область, город Шатура, спуск Гоголя, 88;268;Тамара Дмитриевна Семёноваа;6148685143;196332656
МФО;Монтаж;email: zakar.sazonova@gavrilov.ru;(495) 867-76-15;не указано;066594, Магаданская область, город Шаховская, спуск Сталина, 59;Приоритет = 300;Блохина Сергей Максимович;6142194281;154457435
ООО;ВостокГлав;gordei95@kirillov.ru;(812) 949-29-26;\agents\agent_63.png;217022, Ростовская область, город Озёры, ул. Домодедовская, 19;Приоритет = 107;Инга Фёдоровна Дмитриева;3580946305;405017349
МФО;Газ;ulyna.antonov@noskov.ru;(35222) 22-45-58;\agents\agent_76.png;252821, Тамбовская область, город Пушкино, ул. Чехова, 40;170;Терентьев Илларион Максимович;8876413796;955381891
ОАО;ЭлектроТранс;boleslav.zukova@nikiforova.com;phone: (812) 342-24-31;\agents\agent_91.png;434616, Калининградская область, город Павловский Посад, пл. Ладыгина, 83;Приоритет = 129;Сава Александрович Титова;6019144874;450629885
ОАО;Электро;likacev.makar@antonov.ru;phone: 8-800-714-36-41;\agents\agent_93.png;966815, Новгородская область, город Одинцово, пр. Космонавтов, 19;Приоритет = 366;Шарапова Елена Дмитриевна;7896029866;786038848
МКК;Гор;maiy12@koklov.net;(495) 973-48-55;\agents\agent_52.png;376483, Калужская область, город Сергиев Посад, ул. Славы, 09;175;Нонна Львовна Одинцоваа;7088187045;440309946
ООО;Компания Гараж;email: asiryeva@andreeva.com;+7 (922) 848-38-54;\agents\agent_66.png;395101, Белгородская область, город Балашиха, бульвар 1905 года, 00;413;Владлена Фёдоровна Ларионоваа;6190244524;399106161
ПАО;ОрионГлав;sermakova@sarova.net;phone: +7 (922) 684-13-74;\agents\agent_106.png;729639, Магаданская область, город Талдом, въезд Будапештсткая, 98;Приоритет = 482;Тимофеева Григорий Андреевич;9032455179;763045792
МФО;ГлавITФлотПроф;savva.rybov@kolobov.ru;phone: (812) 146-66-46;\agents\agent_64.png;447811, Мурманская область, город Егорьевск, ул. Ленина, 24;62;Зыкова Стефан Максимович;2561361494;525678825
ПАО;ТверьМонтажОмск;dteterina@selezneva.ru;8-800-363-43-86;\agents\agent_128.png;761751, Амурская область, город Балашиха, шоссе Гоголя, 02;Приоритет = 272;Матвей Романович Большакова;2421347164;157370604
ОАО;РемСантехОмскБанк;anisimov.mark@vorobev.ru;phone: (812) 182-44-77;\agents\agent_57.png;289468, Омская область, город Видное, пер. Балканская, 33;Приоритет = 442;Фокина Искра Максимовна;6823050572;176488617
ОАО;ЭлектроМоторТрансСнос;inessa.voronov@sidorova.ru;phone: (35222) 43-62-19;отсутствует;913777, Самарская область, город Красногорск, ул. Бухарестская, 49;Приоритет = 151;Людмила Евгеньевна Новиковаа;6608362851;799760512
МКК;ТверьХозМорСбыт;email: marina58@koroleva.com;(495) 416-75-67;\agents\agent_117.png;252101, Ростовская область, город Дорохово, пер. Ленина, 85;207;Аким Львович Субботина;6681338084;460530907
ООО;Компания ТомскХоз;email: nelli11@gureva.ru;phone: +7 (922) 849-13-37;\agents\agent_115.png;861543, Томская область, город Истра, бульвар Славы, 42;464;Лазарева Аркадий Сергеевич;8430391035;961540858
ООО;Компания МясДизайнДизайн;email: gleb.gulyev@belyeva.com;phone: (812) 535-17-25;\agents\agent_53.png;557264, Брянская область, город Серпухов, въезд Гоголя, 34;491;Клементина Сергеевна Стрелкова;8004989990;908629456
ООО;Компания ЖелДорТверьМонтаж;email: burova.zlata@zueva.ru;(495) 521-61-75;\agents\agent_85.png;152424, Рязанская область, город Сергиев Посад, ул. 1905 года, 27;2;Нестор Максимович Гуляев;3325722996;665766347
ООО;МетизТехАвтоПроф;anastasiy.gromov@samsonova.com;phone: (495) 581-42-46;\agents\agent_33.png;713016, Брянская область, город Подольск, пл. Домодедовская, 93;Приоритет = 321;Егор Фёдорович Третьякова;2988890076;215491048
МФО;Гараж;antonin51@korolev.com;(35222) 54-72-59;\agents\agent_90.png;585758, Самарская область, город Красногорск, бульвар Балканская, 13;Приоритет = 107;Панфилов Константин Максимович;2638464552;746822723
МКК;ГазДизайнЖелДор;elizaveta.komarov@rybakov.net;(495) 797-97-33;\agents\agent_49.png;695230, Курская область, город Красногорск, пр. Гоголя, 64;Приоритет = 236;Лев Иванович Третьяков;2396029740;458924890
ОАО;РемГаражЛифт;novikova.gleb@sestakov.ru;phone: 8-800-772-27-53;\agents\agent_65.png;048715, Ивановская область, город Люберцы, проезд Космонавтов, 89;Приоритет = 374;Филатов Владимир Максимович;1656477206;988968838
МФО;СантехБашкир;email: nikodim81@kiseleva.com;phone: +7 (922) 155-87-39;\agents\agent_99.png;180288, Тверская область, город Одинцово, ул. Бухарестская, 37;369 в приоритете на поставку;Виктор Иванович Молчанов;4159215346;639267493
МКК;ЮпитерЛенГараж-М;larkipova@gorbunov.ru;(495) 327-58-25;\agents\agent_48.png;339507, Московская область, город Видное, ул. Космонавтов, 11;470;Васильева Валерия Борисовна;2038393690;259672761
ЗАО;ОрионСофтВодСнос;isukanov@sobolev.com;(35222) 59-75-11;\agents\agent_97.png;577227, Калужская область, город Павловский Посад, наб. Чехова, 35;361 в приоритете на поставку;Мухина Ян Фёдорович;1522348613;977738715
ОАО;КазХоз;istrelkova@fomin.ru;+7 (922) 728-85-62;нет;384162, Астраханская область, город Одинцово, бульвар Гагарина, 57;Приоритет = 213;Степанова Роман Иванович;6503377671;232279972
ПАО;БухВжух;valentina.bolsakova@aksenova.ru;(495) 367-21-41;отсутствует;481744, Амурская область, город Щёлково, пл. Сталина, 48;Приоритет = 327;Тарасов Болеслав Александрович;2320989197;359282667
ОАО;ХозЮпитер;jisakova@nazarova.com;+7 (922) 332-48-96;\agents\agent_114.png;038182, Курганская область, город Москва, спуск Космонавтов, 16;375;Максимоваа Вера Фёдоровна;6667635058;380592865
МФО;ВостокКазРыб;flukin@misin.org;phone: (495) 987-31-63;\agents\agent_112.png;059565, Оренбургская область, город Истра, шоссе Домодедовская, 27;Приоритет = 361;Самсонов Родион Романович;7411284960;176779733
ЗАО;ЦементКрепТех-М;email: yna.evdokimov@gordeeva.ru;phone: (812) 838-79-58;\agents\agent_82.png;263764, Свердловская область, город Раменское, пер. Косиора, 28;189 в приоритете на поставку;Сергеев Владлен Александрович;5359981084;680416300
МФО;Строй;soloveva.adam@andreev.ru;(812) 447-45-59;отсутствует;763019, Омская область, город Шатура, пл. Сталина, 56;12;Кудрявцев Адриан Андреевич;6678884759;279288618
ЗАО;БашкирЮпитерТомск;dyckov.veniamin@kotova.ru;(812) 189-59-57;\agents\agent_59.png;035268, Сахалинская область, город Волоколамск, проезд Ладыгина, 51;139 в приоритете на поставку;Фадеева Раиса Александровна;1606315697;217799345
ООО;Компания КазМеталКазань;email: mmoiseev@teterin.ru;(495) 685-34-29;\agents\agent_130.png;532703, Пензенская область, город Чехов, наб. Чехова, 81;Приоритет = 252;Валерий Владимирович Хохлова;4598939812;303467543
ООО;Компания Газ;alina56@zdanov.com;phone: (35222) 75-96-85;\agents\agent_120.png;310403, Кировская область, город Солнечногорск, пл. Балканская, 76;Приоритет = 445;Давид Андреевич Фадеев;2262431140;247369527
ООО;Компания Монтаж;afanasev.anastasiy@muravev.ru;phone: (35222) 92-45-98;\agents\agent_75.png;036381, Брянская область, город Кашира, бульвар Гагарина, 76;124;Силин Даниил Иванович;6206428565;118570048
ЗАО;СервисХмельМонтаж;galina31@melnikov.ru;+7 (922) 344-73-38;\agents\agent_92.png;928260, Нижегородская область, город Балашиха, пл. Косиора, 44;124 в приоритете на поставку;Анжелика Дмитриевна Горбунова;3459886235;356196105
ОАО;ВодГараж;email: pmaslov@fomiceva.com;+7 (922) 363-86-67;\agents\agent_67.png;988899, Саратовская область, город Раменское, пр. Славы, 40;250 в приоритете на поставку;Лаврентий Фёдорович Логинова;5575072431;684290320
МКК;CибГаз;inna.sarova@panfilov.ru;(495) 945-37-25;\agents\agent_103.png;365674, Архангельская область, город Серебряные Пруды, пр. Ленина, 29;488;Вячеслав Романович Третьякова;6483417250;455013058
МКК;БашкирФлотМотор-H;email: morozova.nika@kazakova.ru;phone: (495) 793-84-82;\agents\agent_36.png;008081, Тюменская область, город Ногинск, въезд Гагарина, 94;416;Марат Алексеевич Фролов;1657476072;934931159
ПАО;МеталСервисМор;xdanilov@titov.ru;(35222) 91-28-62;нет;293265, Иркутская область, город Клин, пр. Славы, 12;475;Коновалова Кирилл Львович;6922817841;580142825
ЗАО;Рем;zanna25@nikiforova.com;phone: (495) 987-88-53;\agents\agent_79.png;707812, Иркутская область, город Шаховская, ул. Гагарина, 17;Приоритет = 329;Шароваа Елизавета Львовна;3203830728;456254820
ООО;СантехСеверЛенМашина;email: pgorbacev@vasilev.net;(812) 918-88-43;\agents\agent_74.png;606990, Новосибирская область, город Павловский Посад, въезд Домодедовская, 38;201;Павел Максимович Рожков;3506691089;830713603
ООО;Цемент;panova.klementina@bobrov.ru;8-800-517-78-47;\agents\agent_54.png;084315, Амурская область, город Шаховская, наб. Чехова, 62;340;Анфиса Фёдоровна Буроваа;9662118663;650216214
ЗАО;Вод;email: savva86@zaiteva.ru;(495) 142-19-84;\agents\agent_129.png;964386, Оренбургская область, город Чехов, пл. Косиора, 80;359;Зоя Романовна Селезнёва;1296063939;447430051
ПАО;Орион;email: aleksei63@kiselev.ru;8-800-621-61-93;\agents\agent_77.png;951035, Ивановская область, город Ступино, шоссе Космонавтов, 73;166;Мартынов Михаил Борисович;2670166502;716874456
ОАО;СтройГорНефть;email: lysy.kolesnikova@molcanova.com;phone: (812) 385-21-37;\agents\agent_37.png;444539, Ульяновская область, город Лотошино, спуск Будапештсткая, 95;161 в приоритете на поставку;Тарасова Макар Максимович;5916775587;398299418
ООО;Компания Хмель;ermakov.mark@isakova.ru;phone: (812) 421-77-82;отсутствует;889757, Новосибирская область, город Раменское, бульвар 1905 года, 93;2;Владимир Борисович Суворова;9004087602;297273898
ООО;Компания ВодАлмазIT;zakar37@nikolaeva.ru;(35222) 52-76-16;\agents\agent_111.png;302100, Нижегородская область, город Мытищи, пер. 1905 года, 63;31;Гуляев Егор Евгеньевич;2345297765;908449277
ПАО;БашкирРечТомск;email: aleksandra77@karpov.com;8-800-254-71-85;\agents\agent_100.png;136886, Амурская область, город Видное, въезд Космонавтов, 39;84;Назарова Вера Андреевна;7027724917;823811460
ЗАО;СофтРосБух;ivanova.antonin@rodionov.ru;+7 (922) 445-69-17;\agents\agent_124.png;747695, Амурская область, город Сергиев Посад, въезд Бухарестская, 46;69;Белова Полина Владимировна;8321561226;807803984
МКК;ТелекомЮпитер;kulikov.adrian@zuravlev.org;(812) 895-67-23;\agents\agent_81.png;959793, Курская область, город Егорьевск, бульвар Ленина, 72;302;Калинина Татьяна Ивановна;9383182378;944520594
ЗАО;УралСтройХмель;email: aleksandr95@kolobova.ru;(35222) 39-23-65;\agents\agent_113.png;462632, Костромская область, город Шаховская, шоссе Сталина, 92;Приоритет = 372;Август Борисович Красильникова;8773558039;402502867
МФО;АсбоцементТехАвто;matveev.yliy@kiseleva.ru;+7 (922) 977-68-84;\agents\agent_110.png;304975, Пензенская область, город Солнечногорск, шоссе Балканская, 76;247 в приоритете на поставку;Сидорова Любовь Ивановна;7626076463;579234124
ООО;Компания ФинансСервис;email: robert.serbakov@safonova.ru;(812) 878-42-71;\agents\agent_38.png;841700, Брянская область, город Серпухов, спуск Домодедовская, 35;395 в приоритете на поставку;Клавдия Сергеевна Виноградова;7491491391;673621812
ОАО;Софт;jterentev@ersov.com;(35222) 12-82-65;\agents\agent_122.png;453714, Смоленская область, город Одинцово, спуск Косиора, 84;292;Петухова Прохор Фёдорович;3889910123;952047511
ОАО;ТелекомГор;gorskov.larisa@kalinin.com;(35222) 78-93-21;\agents\agent_98.png;210024, Белгородская область, город Сергиев Посад, наб. Ломоносова, 43;Приоритет = 255;Ксения Андреевна Михайлова;3748947224;766431901
ПАО;РемСтрем;rafail96@sukin.ru;phone: (35222) 55-28-24;\agents\agent_116.png;373761, Псковская область, город Наро-Фоминск, наб. Гагарина, 03;88;Альбина Александровна Романова;9006569852;152177100
ООО;Лифт;email: zinaida01@bespalova.ru;phone: (812) 484-92-38;\agents\agent_101.png;479565, Курганская область, город Клин, пл. Ленина, 54;92;Вера Евгеньевна Денисоваа;6169713039;848972934
ООО;Компания МоторТелекомЦемент-М;larisa44@silin.org;(812) 857-95-57;\agents\agent_118.png;021293, Амурская область, город Наро-Фоминск, шоссе Славы, 40;237;Иван Евгеньевич Белоусова;7326832482;440199498
ОАО;ЮпитерТяжОрионЭкспедиция;email: gblokin@orlov.net;phone: (35222) 95-63-65;\agents\agent_44.png;960726, Томская область, город Орехово-Зуево, въезд 1905 года, 51;446;Валерий Евгеньевич Виноградов;6843174002;935556458
МФО;Транс;artem.fadeev@polykov.com;8-800-954-23-89;\agents\agent_127.png;508299, Кемеровская область, город Кашира, пер. Гагарина, 42;38;Евсеева Болеслав Сергеевич;9604275878;951258069
ОАО;РемВод;komarov.elizaveta@agafonova.ru;+7 (922) 353-31-72;\agents\agent_126.png;449723, Смоленская область, город Наро-Фоминск, пер. Ломоносова, 94;1 в приоритете на поставку;Медведеваа Ярослава Фёдоровна;3986603105;811373078
ПАО;АсбоцементЛифтРеч-H;vladlena58@seliverstova.ru;(495) 245-57-16;\agents\agent_105.png;599158, Ростовская область, город Озёры, ул. Космонавтов, 05;407;Кондратьева Таисия Андреевна;6567878928;560960507
ООО;РосАвтоМонтаж;lapin.inessa@isaeva.com;(495) 445-97-76;\agents\agent_55.png;331914, Курская область, город Ногинск, спуск Ладыгина, 66;10 в приоритете на поставку;Диана Алексеевна Исаковаа;4735043946;263682488
ООО;Компания СервисТелеМотор;email: veronika.egorov@bespalova.com;phone: +7 (922) 461-25-29;\agents\agent_102.png;625988, Вологодская область, город Озёры, пр. Гоголя, 18;81 в приоритете на поставку;Фролова Эдуард Борисович;3248454160;138472695
ПАО;ФинансТелеТверь;email: medvedev.klim@afanasev.com;(812) 115-56-93;\agents\agent_45.png;687171, Томская область, город Лотошино, пл. Славы, 59;100;Зайцеваа Дарья Сергеевна;2646091050;971874277
ОАО;ВодГор;tvetkova.robert@sorokin.com;phone: (35222) 73-72-16;\agents\agent_125.png;265653, Калужская область, город Ступино, шоссе Гоголя, 89;Приоритет = 72;Фаина Фёдоровна Филиппова;4463113470;899603778
ОАО;ТяжРадиоУралПроф;liliy62@grisina.ru;+7 (922) 885-66-15;\agents\agent_88.png;521087, Орловская область, город Егорьевск, шоссе Ладыгина, 14;278;София Алексеевна Мухина;5688533246;401535045
ОАО;ГаражЛофт;lydmila.belyeva@karpov.ru;(495) 427-55-66;\agents\agent_108.png;294596, Мурманская область, город Шаховская, пр. Домодедовская, 88;Приоритет = 335;Клавдия Фёдоровна Кудряшова;2816939574;754741128
ОАО;ITСтройАлмаз;fokin.eduard@samoilov.com;8-800-185-78-91;\agents\agent_83.png;361730, Костромская область, город Волоколамск, шоссе Славы, 36;Приоритет = 159;Алексеева Валериан Андреевич;7689065648;456612755
ООО;Асбоцемент;antonin19@panfilov.ru;phone: 8-800-211-16-23;\agents\agent_34.png;030119, Курганская область, город Дмитров, пер. Славы, 47;Приоритет = 273;Никитинаа Антонина Андреевна;1261407459;745921890
