Тип агента;Наименование агента;Электронная почта агента;Телефон агента;Логотип агента;Юридический адрес;Приоритет;Директор;ИНН;КПП
ЗАО;ТекстильУралАвтоОпт;hkononova@pavlova.ru;phone: (35222) 98-76-54;не указано;028936, Магаданская область, город Видное, ул. Гагарина, 54;176;Алина Сергеевна Дьячковаа;3930950057;678529397
ООО;Компания КрепЦемент;rusakov.efim@nikiforov.ru;phone: (812) 963-77-87;\agents\agent_50.png;423477, Мурманская область, город Кашира, бульвар Домодедовская, 61;426;Екатерина Львовна Суворова;3025099903;606083992
ОАО;КазаньТекстиль;osimonova@andreeva.com;(35222) 86-74-21;\agents\agent_47.png;231891, Челябинская область, город Шатура, бульвар Ладыгина, 40;156 в приоритете на поставку;Александров Бронислав Максимович;4584384019;149680499
ОАО;КазЮпитерТомск;tgavrilov@frolov.ru;+7 (922) 772-33-58;\agents\agent_60.png;393450, Тульская область, город Кашира, пр. 1905 года, 47;244 в приоритете на поставку;Рафаил Андреевич Копылов;9201745524;510248846
МФО;Бух;belova.vikentii@konstantinova.net;phone: +7 (922) 375-49-21;\agents\agent_78.png;409600, Новгородская область, город Ногинск, пл. Гагарина, 68;82;Татьяна Сергеевна Королёваа;1953785418;122905583
ПАО;Радио;rtretykova@kozlov.ru;8-800-897-32-78;\agents\agent_43.png;798718, Ленинградская область, город Пушкино, бульвар Балканская, 37;221;Эмма Андреевна Колесникова;9077613654;657690787
ЗАО;Креп;savina.dominika@belousova.com;phone: (495) 217-46-29;\agents\agent_39.png;336489, Калининградская область, город Можайск, наб. Славы, 35;371;Назар Алексеевич Григорьева;4880732317;258673591
ОАО;Мобайл;email: dsiryev@dementeva.com;8-800-618-73-37;\agents\agent_107.png;606703, Амурская область, город Чехов, пл. Будапештсткая, 91;464;Екатерина Сергеевна Бобылёва;7803888520;885703265
МКК;CибБашкирТекстиль;vzimina@zdanova.com;(495) 285-78-38;\agents\agent_69.png;429540, Мурманская область, город Воскресенск, пл. Славы, 36;Приоритет = 218;Григорий Владимирович Елисеева;7392007090;576103661
МКК;МеталТекстильЛифтТрест;email: muravev.trofim@sazonov.net;(812) 753-96-76;\agents\agent_86.png;786287, Свердловская область, город Волоколамск, пер. Будапештсткая, 72;425;Одинцов Назар Борисович;2971553297;821859486
ПАО;ОрионТомскТех;faina.tikonova@veselov.com;+7 (922) 542-89-15;\agents\agent_119.png;738763, Курская область, город Егорьевск, спуск Чехова, 66;Приоритет = 73;Георгий Александрович Лукин;9351493429;583041591
ПАО;ЖелДорДизайнМетизТраст;lnikitina@kulikova.com;(812) 123-63-47;не указано;170549, Сахалинская область, город Видное, проезд Космонавтов, 89;290;Игорь Львович Агафонова;7669116841;906390137
ОАО;БухМясМоторПром;varvara49@savin.ru;(35222) 83-23-59;\agents\agent_95.png;677498, Костромская область, город Зарайск, спуск Славы, 59;Приоритет = 158;Нина Дмитриевна Черноваа;7377410338;592041317
